{
  "schema_version": "1.0",
  "stage": "INTAKE",
  "status": "PASS",
  "inputs": [
    {
      "path": "decisions/H0-selection.json",
      "sha256": "10795acb2adf0aa39250f1e089f59e27abc95ac39d2c53d26e0101f0152b2df9"
    },
    {
      "path": "00-selection/handoff.json",
      "sha256": "ae4a29da77fa8ec6b8b8f231303a35ad59fb19a6ebe1c52b6c48df195e0ca3ab"
    },
    {
      "path": "00-selection/选题评分.json",
      "sha256": "e34444ab34aa979060e636cdbdbd0b7cb1baa5df1d9a4778ae383f93f02e2ac8"
    },
    {
      "path": ".workflow/config.json",
      "sha256": "a70daeae1b0ccd646806d328ad9adb036f0f26faff21597b50cfa91831deed11"
    },
    {
      "path": "input/format2026.doc",
      "sha256": "d77de49534649b46ca195d32bd9c56a1fbe06dc96fdcf3e1199e6dd7d9831f4a"
    },
    {
      "path": "input/A��/A��.pdf",
      "sha256": "052d8014bff5727c019b72e44fdffaf5c145ce04050dd938baaf3527db331736"
    },
    {
      "path": "input/A题/附件/附件1.xlsx",
      "sha256": "7ef32870abeef420b89560b2530ff60dfe4255917805151d89988d0311af9dd7"
    },
    {
      "path": "input/A题/附件/附件2.xlsx",
      "sha256": "5563acbfa4b4afb10cc6c03e2207e5369bf39da27576672aff14cc5c32e704af"
    },
    {
      "path": "input/A题/附件/附件3/result1.xlsx",
      "sha256": "23b261b295c1b787d000eebbca6521c37075107b6fcf78724f8d395ce1798ff4"
    },
    {
      "path": "input/A题/附件/附件3/result2.xlsx",
      "sha256": "23b261b295c1b787d000eebbca6521c37075107b6fcf78724f8d395ce1798ff4"
    },
    {
      "path": "input/A题/附件/附件3/result3.xlsx",
      "sha256": "07e4793d620a7f899804c0298d49a16a197960440fd47f8bb780c57ec27e2859"
    },
    {
      "path": "input/A题/附件/附件3/result4.xlsx",
      "sha256": "86e9300ffa3d30c43de895ea6723da943e85b8740b137bcae5af7107f076eeac"
    }
  ],
  "outputs": [
    {
      "path": "01-intake/赛题结构化说明.json",
      "sha256": "abe67290839ebc4cc0d99ef1ea9f6b89c9c4136487c75b33012af53063d3156d"
    },
    {
      "path": "01-intake/附件清单.json",
      "sha256": "cb91743b88956dda12f26998d8921bc057bf536908e751e94c312fdf64439caf"
    },
    {
      "path": "01-intake/数据审计报告.md",
      "sha256": "4c5bcaa54da982f9f849b34715d22c3d26ea0998c99af2bb054c384f7f51c3ce"
    },
    {
      "path": "01-intake/问题方法约束矩阵.md",
      "sha256": "d8c0b6267467e9e9b8091fc8628cee97d3837d80f3899a1d5dceb52103283851"
    },
    {
      "path": "01-intake/官方规则与AI合规.md",
      "sha256": "22fd8a06203f034f191ed3a69759b3f7d7a05ef596aa5b17e7bc13437ce774d9"
    },
    {
      "path": "01-intake/H1-选择包.md",
      "sha256": "40bfdce74a7337c0337be0103c7d971f07b481e379de9369cd669e62ec6077f4"
    }
  ],
  "frozen_decisions": [
    {
      "path": "decisions/H0-selection.json",
      "sha256": "10795acb2adf0aa39250f1e089f59e27abc95ac39d2c53d26e0101f0152b2df9"
    }
  ],
  "assumptions": [],
  "unknowns": [
    "是否批准一维径向轴对称并忽略轴向端面效应及非均匀初始场。",
    "附件1的烘房水分浓度与药材干基含水率是否可直接构造传质势差。",
    "问题2—4是否沿用问题1的对流换热和传质系数。",
    "t>14400 s时烘房温度和水分浓度采用末值、稳态窗口统计值还是团队提供的工艺设定值。",
    "result1/result2是否包含t=0行，以及result2完整1 s输出的终点是否严格为3 h。",
    "问题4是否继承问题3的C<0.15 kg/kg全域停止判据，以及数值容差与时长精度。",
    "问题4的圆柱长度是否保持25 cm，R(t)采用何种保形插值。",
    "问题4选择参考域变换、前沿贴合移动有限体积还是固定网格活动域方法族，以及result4域外单元口径。",
    "题设经验公式的实验来源、标定C/T范围和参数不确定性未提供。",
    "2026中国知网客户端的校验值上传与实际文件上传细分时段尚未从可检索官方文本独立核验；具体赛区附加要求未知。"
  ],
  "claims": [
    "朱冠熹已在H0批准A题；INTAKE未改向且未读取其他题目的题面或附件。",
    "A题核心题面、附件1、附件2、附件3四个模板和format2026.doc均存在且可读；所有本阶段声明的输入均已计算SHA-256。",
    "附件1有241条有效记录、60 s等间隔、无缺失无重复；附件2有145条有效记录、1800 s等间隔、半径单调非增、无缺失无重复。",
    "问题4的合格方法族必须显式处理移动域，并通过半径再现、常半径回归、几何守恒、质量平衡、边界残差、网格时间步收敛和插值敏感性验证。",
    "2026官方规则允许AI辅助但要求团队主导核心建模分析、逐项人工核验、论文声明和支撑材料中的AI使用详情PDF。",
    "选择A题人数较少仅为未验证团队判断，不得作为论文事实。"
  ],
  "evidence": [
    "赛题结构化说明.json将已知、全部显式/隐式子问题、约束和交付物四类清单及跨问题关系机器化。",
    "附件清单.json记录A题全部输入文件的类型、大小、SHA-256、工作表/页数和数据轮廓。",
    "数据审计报告.md记录字段、单位、缺失、范围、时间顺序、物理一致性、插值风险、公式适用范围和移动边界验证合同。",
    "问题方法约束矩阵.md逐个覆盖Q1.1—Q4.3，给出任务类型、基线、暂定方法族、数据依据、约束、验证和被排除方法族。",
    "官方规则与AI合规.md仅采用全国大学生数学建模竞赛官网及题目包format2026.doc核验2026规则，并将未核验项目显式标注。",
    "H1-选择包.md把所有影响问题定义和问题4移动边界实现的选项交给团队决定，没有写入TEAM_APPROVED或最终算法。"
  ],
  "warnings": [
    "A题PDF的实际目录名和文件名含乱码字符，必须继续以SHA-256 052d8014bff5727c019b72e44fdffaf5c145ce04050dd938baaf3527db331736识别。",
    "上游00-selection/handoff.json未声明附件3四个结果模板；本阶段已补入输入清单和哈希，但未修改上游文件。",
    "问题3/4长时仿真超出附件1的4 h环境边界；未获H1批准前不得选择延拓规则。",
    "附件2后段大量半径平台受到三位小数定量化影响，直接差分R'(t)与无约束平滑都可能引入偏差。",
    "本地format2026.doc主体条款与官网2026修订稿一致；提交前仍需核对当届中国知网客户端和赛区最新通知。",
    "handoff输出数组按工作流惯例不包含handoff.json自身，避免不可定义的自哈希；其余六个阶段产物均已声明哈希。"
  ],
  "required_next_actions": [
    "主控验证本handoff的schema、输入输出SHA-256及唯一写入边界。",
    "团队阅读H1-选择包.md并逐项选择几何、初始场、边界延拓、对流系数、停止判据、问题4移动边界方法族及result4输出口径。",
    "由团队在decisions中创建正式H1决定记录；本INTAKE阶段不得代写TEAM_APPROVED。",
    "H1若批准，主控进入WAITING_FOR_LITERATURE并停止，不得直接启动DESIGN。",
    "提交前从当届中国知网竞赛管理系统和具体赛区通知核对2026校验值/文件上传时段及附加要求。",
    "主控按真实情况更新权威AI使用日志，确保最终AI声明和AI工具使用详情.pdf可追溯。"
  ],
  "completed_at": "2026-09-10T21:46:08+08:00"
}
