{
  "schema_version": "1.0",
  "stage": "PAPER",
  "status": "PASS",
  "inputs": [
    {"path": "decisions/H1-problem.json", "sha256": "17c2c7142ca1a05c63cce41e3b003856320fd69ec5ecb35eda02c7d8fe6ed835"},
    {"path": "decisions/H2-model.json", "sha256": "84dad8391f99a8e46c1a41af777a80be5d6fc841eaa16a085ae994798c67693a"},
    {"path": "decisions/H3-claims.json", "sha256": "acbbe29553e024be0fd7fec0fd4cf63dcd03abca077a5b2dd21e71dc032ca5b2"},
    {"path": "02-design/handoff.json", "sha256": "4b5dc84ebf16402badf2a3d3c2cea57ae4cb363595bf3a4d9d912f66ea59ec84"},
    {"path": "04-compute/handoff.json", "sha256": "ee1eb3e2ad117c388e90d7a95748cae1145f8ee81ccf9c6e8635821e8c051227"},
    {"path": "05-evidence/handoff.json", "sha256": "f292d5e4e2c34e4baa45cb2e44acc849d831869fff8db3416000ab9fd4f356f2"},
    {"path": "06-figure/handoff.json", "sha256": "914a88494f3aa05229ce5261608b92ccd16a6aa566e3f9c8b6b6ecef649b87c7"}
  ],
  "outputs": [
    {"path": "07-paper/完整论文-LaTeX/main.tex", "sha256": "69b89fe565f400081cdd27252570722ceb19e6843d2a0a4b16aac36551228885"},
    {"path": "07-paper/完整论文-LaTeX/ai-details.tex", "sha256": "d97b4a5973662015f8487af850c56924bed7f5b8ec96201fac6029c41ce29d17"},
    {"path": "07-paper/完整论文.pdf", "sha256": "8ae946ea2db902b2f1f30a8ccc43f131dd3e3eff1c73281536b39fae34cea983"},
    {"path": "07-paper/完整论文.build.json", "sha256": "ecd695b9d94e7bbcb5ac2932e2de4d5e0361e04d1e819f9070b28f81af24a978"},
    {"path": "07-paper/build-manifest.json", "sha256": "ecd695b9d94e7bbcb5ac2932e2de4d5e0361e04d1e819f9070b28f81af24a978"},
    {"path": "07-paper/AI使用声明.md", "sha256": "f1649c7dee63fa51c9c64cb459db6afbfa2d51372af4abf34a9b1ade584b3d40"},
    {"path": "07-paper/支撑材料/AI工具使用详情.pdf", "sha256": "49095e4bc49a2814d85302f621196bd4047fe3a1095e17355b07ae0c1bc844c1"},
    {"path": "07-paper/支撑材料.zip", "sha256": "3944281ea86787fab0cbb4a2d0ac1d473dc803c862d095c10be7c0cef78c1ee3"},
    {"path": "07-paper/构建记录.json", "sha256": "6f915b1c092c23e366f63facb6bf78c615c4630d3263dfa042291790e1aa52b1"}
  ],
  "frozen_decisions": [
    {"path": "decisions/H1-problem.json", "sha256": "17c2c7142ca1a05c63cce41e3b003856320fd69ec5ecb35eda02c7d8fe6ed835"},
    {"path": "decisions/H2-model.json", "sha256": "84dad8391f99a8e46c1a41af777a80be5d6fc841eaa16a085ae994798c67693a"},
    {"path": "decisions/H3-claims.json", "sha256": "acbbe29553e024be0fd7fec0fd4cf63dcd03abca077a5b2dd21e71dc032ca5b2"}
  ],
  "assumptions": [
    "No new substantive assumptions were introduced.",
    "B remains the baseline; F remains the n-point Hann discrete FFT main model; P is diagnostic only; M remains closed with GATE_NOT_TRIGGERED.",
    "Only q and conditional d(n) are reported; no unique true thickness is claimed."
  ],
  "unknowns": [
    "Matched linear refractive-index and extinction-coefficient curves remain unavailable.",
    "Independent true thickness, coherence length, angular error, roughness and wedge remain unavailable.",
    "Exact configured model versions were not exposed by the workflow logs; the AI detail PDF states this rather than inventing identifiers."
  ],
  "claims": [
    "The paper preserves the H3-approved N1 narrative and all approved negative evidence.",
    "The final PDF contains 8 A4 pages, with 6 body pages and appendix beginning on page 8.",
    "Automated LaTeX/PDF validation passed with zero build warnings, no blank pages, all fonts embedded and minimum effective raster DPI 454.",
    "All 8 paper pages and both AI-detail pages were rendered and visually inspected.",
    "The paper PDF and support ZIP are each below the conservative 20,000,000-byte limit."
  ],
  "evidence": [
    "07-paper/构建记录.json",
    "07-paper/build-manifest.json",
    "07-paper/完整论文-LaTeX/latex-project.json",
    "07-paper/支撑材料/logs/复现清单.json",
    "07-paper/支撑材料/logs/full-run.json"
  ],
  "warnings": [
    "The compatible LaTeX template is a bundled fallback, not an official current-year LaTeX template.",
    "PAPER PASS means a reviewable, reproducible draft; it is not approval for competition submission.",
    "H4 human review and school/provincial supplemental-rule checks remain pending.",
    "The AI-use detail truthfully records that exact configured model versions were unavailable in the workflow log."
  ],
  "required_next_actions": [
    "Stop at the boundary before AUDIT, as requested.",
    "Run the independent AUDIT stage in a fresh task when authorized.",
    "After AUDIT, the team must perform H4 item-by-item human review and decide whether to submit."
  ],
  "completed_at": "2026-09-10T16:51:57+08:00"
}
