{
  "schema_version": "1.0",
  "stage": "PROTOTYPE",
  "status": "PASS",
  "inputs": [
    {
      "path": "decisions/H1-problem.json",
      "sha256": "17c2c7142ca1a05c63cce41e3b003856320fd69ec5ecb35eda02c7d8fe6ed835"
    },
    {
      "path": "decisions/prototype-authorization.json",
      "sha256": "2e71d5264db8edf2f30c257c45029f7c72a32f33b7a8a0f8e813e3fea67f90a1"
    },
    {
      "path": "02-design/handoff.json",
      "sha256": "4b5dc84ebf16402badf2a3d3c2cea57ae4cb363595bf3a4d9d912f66ea59ec84"
    },
    {
      "path": "02-design/验证计划.json",
      "sha256": "b955613e967389fad2d9ee4bc7126707713e9e1f2021987838cae5864d8ccfe7"
    },
    {
      "path": "02-design/H2-优化审计与方向.md",
      "sha256": "24454cb8aede1dd933b0fbb9c4fa62d86533ef44a5bab6a05fedf990e94dc9c6"
    },
    {
      "path": "02-design/contracts/model-baseline-fringe.json",
      "sha256": "c06d9c2a1033312bb0e63dec9d43d71e8daa425fde080eed6e8a2222977bef71"
    },
    {
      "path": "02-design/contracts/model-fft-optical.json",
      "sha256": "8b2d6d77d38561a098199807e893d4a987af1a12bdc29ae58ea9133722261e8a"
    },
    {
      "path": "02-design/contracts/model-physical-regression.json",
      "sha256": "86b96c97e2986f540c67cf85c3489d3f825211bfbe3922ace6c6d9ba5a21cfb8"
    },
    {
      "path": "02-design/contracts/model-multibeam-transfer.json",
      "sha256": "8fe01a49e768cbced0511c917310bda326b29cf2dd0478a0eac14eedb855375f"
    },
    {
      "path": "input/B题/附件/附件1.xlsx",
      "sha256": "b42f8bdabe7497951284cd044386c3cdf9d349b5e8ef4baaa0336e65ff84c67b"
    },
    {
      "path": "input/B题/附件/附件2.xlsx",
      "sha256": "24b3113e80d5ec5458ba4f447df9ed185578481e8b0081bdf0673689505e49d0"
    },
    {
      "path": "input/B题/附件/附件3.xlsx",
      "sha256": "79e9f66a00409f1d1130d9f4f3d76b4d5e5a1ccd3ac2d24dc0af8ecc583d0ec8"
    },
    {
      "path": "input/B题/附件/附件4.xlsx",
      "sha256": "9cf1400404c4560958da06685beb8c2e1e4df5918a6e13863663a54440ba12e3"
    }
  ],
  "outputs": [
    {
      "path": "03-prototype/build_handoff.py",
      "sha256": "ea0080e0e7ea50910c3088cc106c1bf80af49c55cedaad1986c6edaaeec7c223"
    },
    {
      "path": "03-prototype/environment.json",
      "sha256": "26833a50da3a955edc64b283f323f8f9404a80e4a5a7fc112d81fc5164dddcfa"
    },
    {
      "path": "03-prototype/H2-选择包.md",
      "sha256": "1d5e3971f55bd0bdd2e72e5d711a3da5c496d96a38c2c6c429ae2e66ba6e6ac8"
    },
    {
      "path": "03-prototype/model-b/output.json",
      "sha256": "408d997bd89066161cc9927c946beebee5b38147cd6993ad76a05bcbeca2c446"
    },
    {
      "path": "03-prototype/model-b/README.md",
      "sha256": "1c3d8879ef3e4ba8bd3bf30d68b9aaf49601df35d2ea4af141ae18c2268d4fb5"
    },
    {
      "path": "03-prototype/model-f/output.json",
      "sha256": "21de368aa247a03ac5dcf24b6a214620c630769cca6b47867e64470665ef27b6"
    },
    {
      "path": "03-prototype/model-f/README.md",
      "sha256": "d228c1e57e42a2255b68dd8b2079aca96e7586038d29a9255d81d9eb02cb9206"
    },
    {
      "path": "03-prototype/model-m/output.json",
      "sha256": "7bcaa9acdadc5c300c6c7cc87bcb5f62bd45aa4e61ad5b8f41d5f1122037abcf"
    },
    {
      "path": "03-prototype/model-m/README.md",
      "sha256": "66d7691a809724645a6141e336520107f39ef4d06be1db98c453ebae8b11aa1b"
    },
    {
      "path": "03-prototype/model-p/output.json",
      "sha256": "4c4750184414378ada3db2d08fff95cd80ed15947a4e86bea73b8824002b6320"
    },
    {
      "path": "03-prototype/model-p/README.md",
      "sha256": "fd067d5dc74cded2de8311ba2c8365b8b4a7854bb21781aaded91e3de24017ba"
    },
    {
      "path": "03-prototype/run_prototypes.py",
      "sha256": "47c5ce19830d5c2efbcf5cfbd7341830f2d2a9b9b05cc4345f1b73bfa31f2e4b"
    },
    {
      "path": "03-prototype/候选方案对比.md",
      "sha256": "ef448d7eb7028aa3187f6967aef2972f3c4ba278348df5c2d90547514aaf7763"
    },
    {
      "path": "03-prototype/原型结果.csv",
      "sha256": "62a206c171e5087e2dee319ed0d7daa07e6c9ddce2c156194cd265e2fb598ddc"
    },
    {
      "path": "03-prototype/预注册规则.json",
      "sha256": "65aa8491340c746aa4ce12cd0e5d127353fd8fdd4990ba45620c4f344ca22747"
    }
  ],
  "frozen_decisions": [
    {
      "path": "decisions/H1-problem.json",
      "sha256": "17c2c7142ca1a05c63cce41e3b003856320fd69ec5ecb35eda02c7d8fe6ed835"
    },
    {
      "path": "decisions/prototype-authorization.json",
      "sha256": "2e71d5264db8edf2f30c257c45029f7c72a32f33b7a8a0f8e813e3fea67f90a1"
    }
  ],
  "assumptions": [
    "A1: 仅在固定局部窗口把n*cos(theta1)视为有效常量；观察到跨窗漂移时不作全谱外推。",
    "A2: 空气折射率为1；本原型只输出q，未用未获证据支持的材料n。",
    "A3: 合成门槛按完整周期与窗口分辨率预注册；失败码和近失效结果保留。",
    "A4: B/F/P使用平行均匀层最低基线；楔度和粗糙度只作为未检验失效解释。",
    "A5: P仅含固定低维线性基线，不外推吸收或样品参数。",
    "A6: 10度与15度先独立；未运行共享厚度联合拟合。",
    "A7: 种子、窗口、掩码、预算、停止规则及支持门槛在观察输出前冻结。"
  ],
  "unknowns": [
    "题目样品匹配的SiC/Si线性n(sigma)、k(sigma)、晶型、掺杂、温度及偏振适用域仍缺直接证据。",
    "仪器分辨率、相干长度、角度误差、粗糙度、楔度和独立厚度真值未知。",
    "跨窗漂移可由色散、基线、吸收、异常或多光束等多种机制产生，本原型不能归因。"
  ],
  "claims": [
    "B/F/P已在同数据、窗口、掩码对、指标、预算和停止规则下完成可复现小型比较。",
    "F相对B的目标稳定性改进达到预注册门槛，证据标记supported；这不是最终模型选择。",
    "P未达到逐案例胜率门槛，证据标记inconclusive；未因较优中位数修改门槛。",
    "M只完成条件诊断接口与退化极限，双门未触发，未准入。",
    "所有观察结果均为条件光学厚度诊断，不是唯一真实厚度。"
  ],
  "evidence": [
    "03-prototype/原型结果.csv保存全部合成和观察模型运行、失败码、诊断量及运行时。",
    "03-prototype/model-b、model-f、model-p和model-m保存最小实现说明与逐模型输出。",
    "03-prototype/预注册规则.json记录冻结的阈值、种子、窗口、掩码、预算和停止规则。",
    "03-prototype/候选方案对比.md与H2-选择包.md给出相对B的supported/inconclusive分类及限制。"
  ],
  "warnings": [
    "PASS仅表示PROTOTYPE产物与验证完整，不表示H2已选择最终路线。",
    "F的supported只针对本预注册原型的目标缺陷；无独立真值，不能解释为真实准确性。",
    "B的OK_CONDITIONAL不保证物理可信；低周期和复杂结构下已观察到误配失败。",
    "不得用本轮输出倒推折射率、窗口或门槛，不得把联合双角结果冒充独立验证。",
    "handoff.json不自列哈希；其自身哈希保存在03-prototype/handoff.sha256。"
  ],
  "required_next_actions": [
    "主控验证handoff schema、所有inputs/outputs哈希及handoff.sha256。",
    "队长在H2中显式审查B/F/P/M证据并作团队选择；本任务在H2前停止。",
    "若H2要求新原型，须先批准具体参数边界、预算和重新预注册门槛；否则不得继续COMPUTE。"
  ],
  "completed_at": "2026-09-07T10:51:39+08:00"
}